"id","name","age","catInfo","wins","loss","img"
"1","Cat McTerror","3","Very loud","27","12","cat1.png"
"2","Caterson CatSpyder Silva","5","Slim, broke leg in past years","35","15","cat02.png"
"5","Kit Kitty Kones","3","Bad kitty, loves to use dog food better strength","33","5","cat05.png"
"6","Coy BigCat Meowson","5","Big kitty, loves to fight","26","20","cat06.png"
"7","Firko Cro Cat","5","Past his prime, doing seminars","38","11","cat03.png"
"8","Cateael The Last Catbender Catesanya","2","Unique fighting style, anime enthusiast","19","1","cat07.png"
"9","Catbib Furwmagomedov","3","Current champion, wrestle and catmbo is his style","28","0","cat04.png"
